{
  "artifacts": [
    {
      "path": "blobs/922bd0d2dc78746a44aee4eb432b64581ad7d14aa0e56d830e7e8c250949ac79",
      "role": "response",
      "sha256": "sha256:922bd0d2dc78746a44aee4eb432b64581ad7d14aa0e56d830e7e8c250949ac79"
    },
    {
      "path": "blobs/ac1986696dc4322442a5cb5299ad67e200f6f0c2ac9ea38417524ff3efda48cd",
      "role": "policy",
      "sha256": "sha256:ac1986696dc4322442a5cb5299ad67e200f6f0c2ac9ea38417524ff3efda48cd"
    },
    {
      "path": "blobs/f1291018b62afe755c23fb7b517807d408777a5c8bbdfeb1a643880b739628e9",
      "role": "toolchain_lock",
      "sha256": "sha256:f1291018b62afe755c23fb7b517807d408777a5c8bbdfeb1a643880b739628e9"
    },
    {
      "path": "blobs/a03abab656ad51bcf1373e29f657dab0a87cb224fc12d9e90a141aad8ff6bce2",
      "role": "compiler",
      "sha256": "sha256:a03abab656ad51bcf1373e29f657dab0a87cb224fc12d9e90a141aad8ff6bce2"
    },
    {
      "path": "blobs/9acfb17678c64cf33d5a4e86ad9ef5aff5560a9cc90a482c0808b962ed1a9a05",
      "role": "graph",
      "sha256": "sha256:9acfb17678c64cf33d5a4e86ad9ef5aff5560a9cc90a482c0808b962ed1a9a05"
    },
    {
      "path": "blobs/4047665261b3d68d862cbbd31177edfd5594067b6fc4fbb7225c84531795c8c5",
      "role": "candidate",
      "sha256": "sha256:4047665261b3d68d862cbbd31177edfd5594067b6fc4fbb7225c84531795c8c5"
    }
  ],
  "binding": {
    "base_revision": 0,
    "candidate_hash": "sha256:4047665261b3d68d862cbbd31177edfd5594067b6fc4fbb7225c84531795c8c5",
    "comparison_graph_hash": null,
    "graph_hash": "sha256:9acfb17678c64cf33d5a4e86ad9ef5aff5560a9cc90a482c0808b962ed1a9a05",
    "observed_head_revision": 0,
    "result_revision": 0
  },
  "commands": [],
  "compiler_hash": "sha256:a03abab656ad51bcf1373e29f657dab0a87cb224fc12d9e90a141aad8ff6bce2",
  "delivery": {
    "artifacts": [],
    "base_revision": 0,
    "diagnostics": [
      {
        "actual": null,
        "base_revision": 0,
        "cause": "capability declaration has no identical trusted host injection",
        "code": "E_CAPABILITY_MISSING",
        "diagnostic_id": "diag_834f0ad3f16bbaec",
        "entity_id": "greeting.listen",
        "expected": null,
        "related_entities": [],
        "retryable": true,
        "severity": "error",
        "stage": "capability_check",
        "suggested_operations": []
      },
      {
        "actual": null,
        "base_revision": 0,
        "cause": "capability declaration has no identical trusted host injection",
        "code": "E_CAPABILITY_MISSING",
        "diagnostic_id": "diag_14e0ffb404aa2bf9",
        "entity_id": "greeting.clock",
        "expected": null,
        "related_entities": [],
        "retryable": true,
        "severity": "error",
        "stage": "capability_check",
        "suggested_operations": []
      },
      {
        "actual": null,
        "base_revision": 0,
        "cause": "runtime call must explicitly select its required trusted host capability",
        "code": "E_CAPABILITY_MISSING",
        "diagnostic_id": "diag_b1d0c642f187917a",
        "entity_id": "greeting.connection.new_r0_817.new_r0_821.arm.0.new_r0_823",
        "expected": null,
        "related_entities": [],
        "retryable": true,
        "severity": "error",
        "stage": "capability_check",
        "suggested_operations": []
      },
      {
        "actual": null,
        "base_revision": 0,
        "cause": "runtime call must explicitly select its required trusted host capability",
        "code": "E_CAPABILITY_MISSING",
        "diagnostic_id": "diag_99d3305b56dd8d66",
        "entity_id": "greeting.serve.new_r0_837.new_r0_838",
        "expected": null,
        "related_entities": [],
        "retryable": true,
        "severity": "error",
        "stage": "capability_check",
        "suggested_operations": []
      }
    ],
    "evidence_id": null,
    "ok": false,
    "result": {
      "candidate": ".il/experiments/dc9e7bb8546b8bdc36e7d0989567152c9f3681d10d5c784aa71e0b9ea639e5d5",
      "graph_hash": "sha256:9acfb17678c64cf33d5a4e86ad9ef5aff5560a9cc90a482c0808b962ed1a9a05",
      "revision": 0
    },
    "result_revision": 0,
    "tool": "transact",
    "tool_version": "1.0.0"
  },
  "policy_hash": "sha256:ac1986696dc4322442a5cb5299ad67e200f6f0c2ac9ea38417524ff3efda48cd",
  "request": {
    "base_revision": 0,
    "operations": [
      {
        "op": "import_text",
        "source": "// From packages/core/lib.il\n@id(\"core\") module core visibility public {\n  @id(\"core.File\") type File = record { slot: U64, generation: U64 } layout opaque;\n  @id(\"core.Deadline\") type Deadline = sum { Infinite, At(U64) };\n  @id(\"core.IoError\") type IoError = sum { Read, Write, Closed, Timeout, PermissionDenied, InvalidData, Other };\n  @id(\"core.AllocError\") type AllocError = sum { OutOfMemory, CapacityOverflow };\n\n  @id(\"core.infinite\") fn infinite() -> Deadline {\n    return Deadline::Infinite();\n  }\n  @id(\"core.deadline_at\") fn deadline_at(instant: U64) -> Deadline {\n    return Deadline::At(instant);\n  }\n  @id(\"core.max_i64\") fn max_i64(left: I64, right: I64) -> I64 {\n    if left > right { return left; }\n    return right;\n  }\n}\n\n// From packages/alloc/lib.il\n@id(\"alloc\") module alloc visibility public imports [core] {\n  @id(\"alloc.StringResult\") type StringResult = Result<String, core.AllocError>;\n\n  @id(\"alloc.concat\") fn concat(left: String, right: String) -> StringResult effects [alloc] {\n    return runtime.string_concat(left, right);\n  }\n  @id(\"alloc.clone_string\") fn clone_string(value: String) -> String effects [alloc] {\n    return clone(value);\n  }\n  @id(\"alloc.clone_bytes\") fn clone_bytes(value: Bytes) -> Bytes effects [alloc] {\n    return clone(value);\n  }\n  @id(\"alloc.string_size\") fn string_size(value: String) -> Usize {\n    return runtime.string_len(value);\n  }\n  @id(\"alloc.bytes_size\") fn bytes_size(value: Bytes) -> Usize {\n    return runtime.bytes_len(value);\n  }\n}\n\n// From packages/io/lib.il\n@id(\"io\") module io visibility public imports [core] {\n  @id(\"io.UnitResult\") type UnitResult = Result<Unit, core.IoError>;\n  @id(\"io.BytesResult\") type BytesResult = Result<Bytes, core.IoError>;\n  @id(\"io.CountResult\") type CountResult = Result<Usize, core.IoError>;\n\n  @id(\"io.print_string\") fn print_string(value: String) -> UnitResult effects [process] {\n    return runtime.print_string(value);\n  }\n  @id(\"io.print_i64\") fn print_i64(value: I64) -> UnitResult effects [process] {\n    return runtime.print_i64(value);\n  }\n  @id(\"io.read_stdin\") fn read_stdin(maximum: Usize, deadline: core.Deadline) -> BytesResult effects [process, alloc] {\n    return runtime.stdin_read(maximum, deadline);\n  }\n  @id(\"io.write_stdout\") fn write_stdout(value: Bytes, deadline: core.Deadline) -> CountResult effects [process] {\n    let length: Usize = runtime.bytes_len(value);\n    let mut offset: Usize = 0;\n    while offset < length {\n      let count: Usize = runtime.stdout_write(value, offset, deadline)?;\n      if count == 0 { return Err(core.IoError::Write()); }\n      offset = offset + count;\n    }\n    return Ok(offset);\n  }\n  @id(\"io.write_stderr\") fn write_stderr(value: Bytes, deadline: core.Deadline) -> CountResult effects [process] {\n    let length: Usize = runtime.bytes_len(value);\n    let mut offset: Usize = 0;\n    while offset < length {\n      let count: Usize = runtime.stderr_write(value, offset, deadline)?;\n      if count == 0 { return Err(core.IoError::Write()); }\n      offset = offset + count;\n    }\n    return Ok(offset);\n  }\n  @id(\"io.close_file\") fn close_file(file: core.File) -> UnitResult effects [fs] {\n    return runtime.file_close(file);\n  }\n}\n\n// From packages/json/lib.il\n@id(\"json\") module json visibility public imports [core] {\n @id(\"json.BytesResult\") type BytesResult=Result<Bytes,core.IoError>;\n @id(\"json.hex_digit\") fn hex_digit(n:U8)->U8 {if n<10{return n+48;}return n+87;}\n @id(\"json.quote\") fn quote(value:String)->BytesResult effects [alloc] {\n  let data:Bytes=runtime.string_to_bytes(value)?;\n  let mut output:Bytes=runtime.bytes_from_u8(34)?;\n  let length:Usize=runtime.bytes_len(data);let mut index:Usize=0;\n  while index<length {\n   let byte:U8=runtime.bytes_get(data,index);\n   if byte==34 {let escaped:Bytes=runtime.string_to_bytes(\"\\\\\\\"\")?;output=runtime.bytes_concat(output,escaped)?;}\n   else if byte==92 {let escaped:Bytes=runtime.string_to_bytes(\"\\\\\\\\\")?;output=runtime.bytes_concat(output,escaped)?;}\n   else if byte<32 {let prefix:Bytes=runtime.string_to_bytes(\"\\\\u00\")?;let high:Bytes=runtime.bytes_from_u8(hex_digit(byte/16))?;let low:Bytes=runtime.bytes_from_u8(hex_digit(byte%16))?;output=runtime.bytes_concat(output,prefix)?;output=runtime.bytes_concat(output,high)?;output=runtime.bytes_concat(output,low)?;}\n   else {let literal:Bytes=runtime.bytes_from_u8(byte)?;output=runtime.bytes_concat(output,literal)?;}\n   index=index+1;\n  }\n  let quote:Bytes=runtime.bytes_from_u8(34)?;return runtime.bytes_concat(output,quote);\n }\n @id(\"json.message\") fn message(value:String)->BytesResult effects [alloc] {\n  let quoted:Bytes=quote(value)?;let prefix:Bytes=runtime.string_to_bytes(\"{\\\"message\\\":\")?;let suffix:Bytes=runtime.bytes_from_u8(125)?;\n  let head:Bytes=runtime.bytes_concat(prefix,quoted)?;return runtime.bytes_concat(head,suffix);\n }\n}\n\n// From packages/tracing/lib.il\n@id(\"tracing\") module tracing visibility public imports [core,json,io] {\n @id(\"tracing.CountResult\") type CountResult=Result<Usize,core.IoError>;\n @id(\"tracing.event\") fn event(code:String)->CountResult effects [alloc,process] {\n  let encoded:Bytes=json.quote(code)?;let prefix:Bytes=runtime.string_to_bytes(\"{\\\"code\\\":\")?;let suffix:Bytes=runtime.string_to_bytes(\"}\\n\")?;\n  let head:Bytes=runtime.bytes_concat(prefix,encoded)?;let line:Bytes=runtime.bytes_concat(head,suffix)?;let count:Usize=io.write_stderr(line,core.Deadline::Infinite())?;return